{
  "$schema": "../case.schema.json",
  "id": "015-end-of-month-clamp-leap-year",
  "description": "End of month: 31 January + 1 month clamps to 29 February (2028 is a leap year), time of day kept.",
  "rule_set_version": "v1",
  "input": {
    "aware_at": "2028-01-30T10:00:00Z",
    "reporting_timezone": "Europe/Berlin",
    "events": [
      {
        "regime": "NIS2",
        "event_type": "significant_incident"
      }
    ],
    "fix_available_at": null,
    "notification_submitted_at": "2028-01-31T10:00:00Z"
  },
  "expected": [
    {
      "rule_id": "nis2.significant_incident.early_warning",
      "status": "due",
      "due_at": "2028-01-31T10:00:00Z"
    },
    {
      "rule_id": "nis2.significant_incident.notification",
      "status": "due",
      "due_at": "2028-02-02T10:00:00Z"
    },
    {
      "rule_id": "nis2.significant_incident.final_report",
      "status": "due",
      "due_at": "2028-02-29T10:00:00Z"
    }
  ]
}
