{
  "$schema": "../case.schema.json",
  "id": "001-cra-vulnerability-all-anchors-known",
  "description": "CRA actively exploited vulnerability with a measure available: final report = fix_available_at + 336h.",
  "rule_set_version": "v1",
  "input": {
    "aware_at": "2026-10-01T09:00:00Z",
    "reporting_timezone": "Europe/Berlin",
    "events": [
      {
        "regime": "CRA",
        "event_type": "actively_exploited_vulnerability"
      }
    ],
    "fix_available_at": "2026-10-05T12:00:00Z",
    "notification_submitted_at": null
  },
  "expected": [
    {
      "rule_id": "cra.actively_exploited_vulnerability.early_warning",
      "status": "due",
      "due_at": "2026-10-02T09:00:00Z"
    },
    {
      "rule_id": "cra.actively_exploited_vulnerability.notification",
      "status": "due",
      "due_at": "2026-10-04T09:00:00Z"
    },
    {
      "rule_id": "cra.actively_exploited_vulnerability.final_report",
      "status": "due",
      "due_at": "2026-10-19T12:00:00Z"
    }
  ]
}
